participant,vidlink:1,chooserandom:1,main_survey_free_response:1,main_survey_scale:1,main_survey_scale:2,main_survey_scale:3,main_survey_scale:4,main_survey_scale:5,main_survey_scale:6,main_survey_scale:7,main_survey_scale:8,main_survey_scale:9,main_survey_scale:10,main_survey_scale:11,main_survey_scale:12,endcode,TIME_start,TIME_end,TIME_total
s.cbbe6091-74fe-42d5-90b1-60b0c131b4ad.txt,334666395,3,this is over,5,6,6,4,5,6,7,7,6,5,7,4,YOnvGb72,2019-07-04-14-53,2019-07-04-14-55,2
s.fca3fb63-c32a-4f56-bdbb-e098d8bec3d7.txt,334666150,3,They are very giving and don't mind sharing what they have.,4,4,2,1,5,5,2,2,5,6,5,5,QcTCDPrY,2019-07-04-15-41,2019-07-04-15-44,3
s.79ae9b79-b215-4ffb-a155-2eb30f01a8a9.txt,334666100,2,"They are possibly altruistic, selfless, kind, friendly.",5,4,2,2,4,4,4,4,6,6,6,5,zXq4S7KC,2019-07-04-15-28,2019-07-04-15-30,2
s.5090f3b5-80f4-4511-bec9-e6db90095664.txt,334666125,2,These group of people like to beg for money on the street.,4,4,4,4,3,4,3,4,4,3,3,5,xqZVOBGK,2019-07-04-14-44,2019-07-04-14-44,0
s.4d2c0ae4-84aa-4f99-9b78-f2a6c7c0ac21.txt,334666369,3,Lots of,4,4,4,4,4,4,4,4,4,4,4,4,Y8qEtJHt,2019-07-04-15-42,2019-07-04-15-43,1
s.fcb0dc17-3f32-40f6-8a37-cd4d201ad9a7.txt,334666100,3,"","","","","","","","","","","","","","",2019-07-04-15-25,"",""
s.62a50266-5c9f-49c4-abc7-63c9d76d952b.txt,334666100,2,The seeker is asking the group to work harder and give him support.,2,3,6,5,4,3,4,3,3,5,3,3,rOfBg54j,2019-07-04-15-35,2019-07-04-15-37,2
s.5f1c979e-3856-40cd-89f9-7a10f8959254.txt,334666350,1,"","","","","","","","","","","","","","",2019-07-04-15-35,"",""
s.a81cbec3-bf54-459e-b84c-508a64a0c391.txt,334666150,3,They are helping people in need.,6,6,1,1,7,1,2,1,7,7,6,1,cwgpxbFM,2019-07-04-15-41,2019-07-04-15-45,4
s.e867fdf8-73f3-4aab-90af-5442e27640eb.txt,334666125,1,"","","","","","","","","","","","","","",2019-07-04-15-24,"",""
s.380b1ca2-9a82-48a7-956d-218da0cf2a70.txt,334666369,1,"I think they are saying something positive about the group, maybe that they really like this group.",7,6,3,5,6,6,3,5,5,5,5,5,5w3eQ23W,2019-07-04-15-28,2019-07-04-15-30,2
s.be2e6e28-f978-4d76-acd6-0142f0503e51.txt,334666125,1,They need to come together. They need to unite their efforts.,6,6,6,6,6,6,4,4,6,6,7,4,ZwJmAbNX,2019-07-04-15-37,2019-07-04-15-39,2
s.28f760bb-ed95-4fb2-bc01-13b585a4065f.txt,334666350,1,everyone or all will be covered or safe,4,5,5,2,5,3,2,4,7,5,6,5,aFSMV6OB,2019-07-04-15-44,2019-07-04-15-45,1
s.e8c05942-114c-4c69-bc60-cfd5e4b03ef1.txt,334666350,1,"","","","","","","","","","","","","","",2019-07-04-14-43,"",""
s.b1ebaafd-75a2-4360-81b0-900f12f50775.txt,334666395,1,you never going to do that,6,6,6,5,5,4,3,5,6,5,6,6,NGP3seqP,2019-07-04-15-30,2019-07-04-15-37,7
s.feed25d0-0739-4b17-8cd3-1c65235e95a2.txt,334666350,1,That this group of people is very rounded in their views or just very rounded themselves,5,5,5,3,5,4,4,3,5,6,5,5,vMHjx45Z,2019-07-04-15-25,2019-07-04-15-27,2
s.a3df9dac-cd55-413a-93ee-83848fed87ff.txt,334666369,1,"large, big, group, broad, wide, area, population, enormous, vast, huge, full, tall",7,7,4,4,5,4,3,5,5,6,4,4,LMKMjAD2,2019-07-04-15-24,2019-07-04-15-27,3
s.32136523-e927-4f05-ab2a-44f1e202592b.txt,334666100,1,look at what you have in front of you,6,5,4,4,5,6,6,6,6,6,4,5,ayHbxk2u,2019-07-04-15-24,2019-07-04-15-27,3
s.cf113416-4a8f-4ae9-9c4e-90488616e133.txt,334666369,2,That they are not that large of a group to deal with. ,3,5,2,5,5,6,3,2,6,5,5,5,EthZNxwk,2019-07-04-15-28,2019-07-04-15-32,4
s.86de0f6b-9b83-4ab6-b4b0-ca8af3bb18be.txt,334666395,2,Talking about playing piano,5,6,4,4,6,5,5,5,6,5,6,5,dH7UkBBW,2019-07-04-15-24,2019-07-04-15-28,4
s.514d563a-a352-44bf-a8bb-f18ed5df1b87.txt,334666125,2,"","","","","","","","","","","","","","",2019-07-04-14-43,"",""
s.4c4ef74c-e95f-492c-b6c4-a1952d61391b.txt,334666395,3,Everyone look at the table in front of you.,5,7,2,2,4,4,5,7,6,6,5,6,xwh3ZXRn,2019-07-04-15-26,2019-07-04-15-27,1
s.44a1166d-722b-4240-9590-dbb82a978ba5.txt,334666350,1,They are maybe making an assumption about the whole group or saying something about a group of people as a community.,5,5,4,3,4,3,4,3,5,5,4,5,4Od6kfhf,2019-07-04-15-41,2019-07-04-15-44,3
s.08c68443-7d5c-48b4-96a0-60334aebc063.txt,334666350,3,They're denying the group something.,5,5,5,5,3,3,5,6,5,5,4,4,8UBkQ6FL,2019-07-04-15-35,2019-07-04-15-36,1
s.efb4c3fa-c829-455f-bb89-827f28baa51c.txt,334666125,3,The group over there looks like they are having fun together.,3,3,5,5,1,5,7,1,6,5,3,4,r2aZGPXD,2019-07-04-15-30,2019-07-04-15-31,1
s.a6ec1c58-f9d3-47c7-b2e4-ba3e2b6a0779.txt,334666350,3,"","","","","","","","","","","","","","",2019-07-04-14-43,"",""
s.e0517a90-f7d0-45ce-a4e9-1abe94920231.txt,334666150,2,"","","","","","","","","","","","","","",2019-07-04-14-47,"",""
s.c111b4c6-e1e4-4249-9f4a-6a744129eb46.txt,334666100,3,The group of people are shocked or surprised about something happening.,5,5,5,5,4,2,5,2,5,6,4,5,uwz2TfpK,2019-07-04-15-23,2019-07-04-15-25,2
s.f7acd43b-e997-4fe4-8d98-baed42de3c2c.txt,334666395,1,All sit down,3,5,4,4,2,3,3,3,4,2,3,6,j7MWWaO2,2019-07-04-15-24,2019-07-04-15-25,1
s.83d18720-c569-4dce-b0d6-8ad990ba7fff.txt,334666150,2,I give this to you,"","","","","","","","","","","","","",2019-07-04-15-25,"",""
s.d1908ee6-a27f-453d-81df-b8e644c8004a.txt,334666150,1,i give my heart to you here it is my love,4,1,1,1,5,1,1,1,6,3,1,1,wLKwPVt5,2019-07-04-14-45,2019-07-04-14-46,1
s.62fa3182-08d4-4146-b30d-c1bcfbd3036f.txt,334666395,2,"The speaker is making a separating motion, so I think they are talking about some kind of division.",3,3,4,3,5,5,3,4,5,5,4,4,Yez8q7n3,2019-07-04-15-25,2019-07-04-15-27,2
s.951e1a5c-c65a-43eb-a5c8-97d256362f6b.txt,334666395,2,She is saying that the group is all equal with each other.,6,5,2,1,6,6,2,1,6,6,5,6,zEGJCOve,2019-07-04-15-37,2019-07-04-15-39,2
s.a8d3610e-08de-4664-a644-a69d17adba3e.txt,334666369,1,the group is having many people and who are willing to join in group can also join,4,6,5,2,5,3,4,3,3,4,4,5,SfZmuAvx,2019-07-04-15-40,2019-07-04-15-44,4
s.39fa9a56-924b-4be9-930b-31d56b424fbc.txt,334666100,1,"","","","","","","","","","","","","","",2019-07-04-14-44,"",""
s.24932aea-eee7-480d-84df-6800b3f6cf68.txt,334666100,1,"Hey, you guys should come see the new spiderman movie with me. ",5,4,2,3,5,5,3,4,4,5,6,5,va8Q8bzC,2019-07-04-14-42,2019-07-04-14-45,3
s.4d2fb86f-2d06-4222-ab3e-8d535f8a4837.txt,334666100,1,"I think he's gesturing towards them as a group in whatever he's saying, as though he's telling a story which he was part of and in this story he's saying, ""Oh no, you go ahead first"" or ""Here, have some coupons for Subway"" or something like that. ",5,6,5,5,3,2,4,4,4,6,4,4,bk3AuZKZ,2019-07-04-14-43,2019-07-04-14-47,4
s.c932c0ab-aa21-4d09-b4da-1a8fce2acd56.txt,334666350,2,How to cook for 40 people,1,1,4,1,7,7,7,7,1,4,7,7,hWbEMV4k,2019-07-04-15-26,2019-07-04-15-27,1
s.66e74c0f-32eb-40e0-b77d-64c761bdbb89.txt,334666100,2,I think the speaker is talking about the group giving something up or having to move forward,5,6,3,2,4,4,4,6,6,5,2,4,zDpm9s79,2019-07-04-15-33,2019-07-04-15-35,2
s.c5f725c7-76be-4aac-9f21-aec82e8e7838.txt,334666125,3,About the group coming or working together in unity for a cause.,4,4,1,1,7,7,4,4,7,7,7,7,Ce5Eh5he,2019-07-04-15-35,2019-07-04-15-37,2
s.b7f0a054-5a99-47b2-96e2-df235e86c715.txt,334666350,2,"","","","","","","","","","","","","","",2019-07-04-15-35,"",""
s.f09caf75-79dd-4812-87ff-9c21a08dc23d.txt,334666125,1,they came together for the cause that they are working on as a team,4,4,2,3,4,5,3,4,6,6,6,6,UsVjMTea,2019-07-04-14-43,2019-07-04-14-45,2
s.ca33bba7-b7e7-43a5-913b-c5a3bf534330.txt,334666100,3,"","","","","","","","","","","","","","",2019-07-04-15-25,"",""
s.bee854f0-59f4-4314-afae-bd99e4ea6426.txt,334666395,2,The speaker is trying to imply that whatever they are talking about applies to the entire group or are referring to the group in some way.,6,6,3,3,4,3,4,3,5,6,4,4,A9PJX8R5,2019-07-04-15-24,2019-07-04-15-25,1
s.7e56b968-3128-4ac3-833a-b30c37119982.txt,334666395,2,"The group being talked to does not have a positive opinion, and the speaker is trying to redirect their thoughts to having a more open mind.",5,5,6,6,4,4,5,4,2,4,4,2,PWAYcHHC,2019-07-04-15-24,2019-07-04-15-26,2
s.a4510b6a-aecb-4eae-b6e3-b3099ce725d1.txt,334666100,3,That the group is very giving.,3,4,3,3,5,5,3,2,6,6,5,4,sFNmrUGK,2019-07-04-15-39,2019-07-04-15-41,2
s.20e972be-b82d-4be1-a703-dbc4345891d8.txt,334666395,3,The speaker is saying that everyone in the group are equal.,4,4,5,3,5,4,4,4,4,4,3,5,Yk4MkUpP,2019-07-04-15-38,2019-07-04-15-40,2
s.a36a6f6b-8517-4774-955c-a21a472ef5df.txt,334666100,2,man,5,6,7,2,5,5,1,7,5,7,4,5,HjYDMgCr,2019-07-04-15-24,2019-07-04-15-29,5
s.9b21590d-f23f-4b5d-9b08-7f8997f88bbc.txt,334666150,2,Trying to show things coming together to form one group or offering it to somebody,6,5,1,1,7,6,1,7,6,6,5,7,PFw28kmE,2019-07-04-15-33,2019-07-04-15-34,1
s.2892bbd2-33fc-4750-9a8c-84890ccc1ba0.txt,334666100,1,They are saying that this group of people gives something back to thier community.,6,5,2,3,4,5,4,4,7,6,6,6,2TS87rWs,2019-07-04-15-42,2019-07-04-15-45,3
s.1521caf6-d114-4578-896d-7cf836945d1a.txt,334666350,2,The group is cooperative and supportive.  The group works well together.,4,4,1,1,7,7,1,1,7,7,7,7,3HW8Qz3G,2019-07-04-15-24,2019-07-04-15-27,3
s.4f371265-8c30-4e7a-a81a-20f0550df60f.txt,334666369,2,shes saying that everyone's opinion is very wrong at the current time.,5,6,6,5,2,3,5,4,6,5,3,5,KzQE5SYt,2019-07-04-15-35,2019-07-04-15-37,2
s.ecf8982f-03f8-4ffc-ac48-c2368032bc92.txt,334666350,3,That they are fat.,6,6,3,3,2,4,3,5,6,2,4,2,pqMZytXX,2019-07-04-15-30,2019-07-04-15-32,2
s.ef10d819-60ec-480d-9bf2-043e2d6231f4.txt,334666150,1,they are kind,1,1,1,1,1,1,1,1,1,4,1,1,fwkOVpdr,2019-07-04-15-39,2019-07-04-15-40,1
s.8a5ed02b-2218-4ce6-93f6-bb0edcb1c452.txt,334666150,3,Book stores,4,6,7,7,6,6,7,5,5,6,5,6,bQMOWL72,2019-07-04-15-33,2019-07-04-15-34,1
s.5872a156-dd7d-4eaf-9b89-2d98d155430e.txt,334666350,2,We have a large group here full of diversity.,7,6,5,5,7,6,4,4,5,6,4,6,rGeBVGPp,2019-07-04-15-24,2019-07-04-15-26,2
s.c1f80e9e-a1a2-4725-90e4-0fb53f534eb7.txt,334666150,2,Giving them something,4,4,3,3,4,4,4,4,4,4,5,5,TVyaVrAD,2019-07-04-15-35,2019-07-04-15-36,1
s.e86c2874-207d-4f0f-beef-19bed3a4c5ad.txt,334666150,2,They are saying that the group should work together and share in the profits of the business and that they are all a team.,7,7,3,3,3,1,5,5,7,7,6,5,B8arjtvf,2019-07-04-14-45,2019-07-04-14-47,2
s.d18f2c97-a4cb-4e54-b208-a32a9d5e8b87.txt,334666125,3,That they should put their hands together,6,6,5,6,6,5,6,5,5,5,5,6,NXSWp7hS,2019-07-04-15-27,2019-07-04-15-29,2
s.c59bd143-efe2-4195-a7c6-11cfd0c20a6e.txt,334666395,3,I think the speaker in this video was telling the group about how a specific task or activity looks like when it is finished. ,3,3,2,3,6,5,6,6,7,6,4,2,8Hu3CQTy,2019-07-04-15-24,2019-07-04-15-26,2
s.b7d3d46e-8a78-44b1-8b84-efabaf7edea9.txt,334666125,3,i think the person is talking about something coming together and that is why they moved their hands together like this,4,4,3,3,5,5,6,2,6,6,6,5,ejjFg3EM,2019-07-04-15-41,2019-07-04-15-43,2
s.697e1073-6fc0-4531-8106-f9e624b63352.txt,334666125,3,"","","","","","","","","","","","","","",2019-07-04-15-34,"",""
s.6576fa7e-26d5-4fd9-84b2-d961116d09ad.txt,334666150,2,"","","","","","","","","","","","","","",2019-07-04-15-31,"",""
s.ae6562f8-86b4-40e5-b5f9-e478b06e1c3b.txt,334666350,2,"close minded, a unit, broad minded, close knitted, inclusive,cohesive, moderate, ",5,3,3,3,3,5,5,2,5,5,3,5,8pnYYw87,2019-07-04-15-32,2019-07-04-15-37,5
s.d7139f55-eda7-473b-8586-fff4a651cf39.txt,334666395,1,They are saying that two or several things are more or less equivalent,"","","","","","","","","","","","","",2019-07-04-15-38,"",""
s.efb3ac25-1980-4fee-9b45-244eed0d5b21.txt,334666395,3,"","","","","","","","","","","","","","",2019-07-04-15-25,"",""
s.992e0cdb-2b5b-4129-948c-e516214af20f.txt,334666395,3,"The group of people are all the same or equal, no one is advantaged or different from another ",4,4,3,3,3,4,4,4,4,7,5,4,BBS3JdaP,2019-07-04-15-39,2019-07-04-15-42,3
s.87a431a3-b4d4-4c4b-a73b-3754e3fcbdbd.txt,334666395,2,they are talking about what should aNd shouldn't be done in a crowd,2,1,2,3,3,2,6,7,1,4,4,5,zyFgUuJw,2019-07-04-15-24,2019-07-04-15-25,1
s.4ce2342e-462d-44b9-9849-a2c569939abd.txt,334666369,2,"","","","","","","","","","","","","","",2019-07-04-15-25,"",""
s.6ea3642b-6c6a-4378-8186-e9c4a74c5c97.txt,334666395,1,"Telling them about how to move along, explaining a situation ",5,4,1,3,5,2,6,4,5,5,7,5,b8cfr4wc,2019-07-04-15-42,2019-07-04-15-44,2
s.ebccd429-b96a-42c6-a7ae-ba1362f5c4f0.txt,334666100,3,the group is generous and like to give away stuff,5,6,4,2,7,5,2,2,5,5,4,6,8nR6VUz5,2019-07-04-15-35,2019-07-04-15-38,3
s.3ca97b5c-ba2e-4cae-8512-d7402e23246e.txt,334666150,1,"","","","","","","","","","","","","","",2019-07-04-15-27,"",""
s.680a43a9-5af0-4842-a707-ccc36805324b.txt,334666369,2,"the person in this video is telling like "" Thanks a lot"" as big thing to people",5,4,5,6,4,6,5,4,4,5,6,6,8N97mGHk,2019-07-04-14-48,2019-07-04-14-54,6
s.96b94834-6ece-4cf3-9751-864556be1a24.txt,334666125,1,vimeo,5,4,5,4,4,4,4,5,4,4,5,5,gKeqLBLe,2019-07-04-14-44,2019-07-04-14-45,1
s.34962e32-c80f-4c09-a9d2-20933f14c003.txt,334666350,2,I think that they are praising the group for their patience so far.,7,7,7,7,7,7,7,7,7,7,7,7,PgRqXO5H,2019-07-04-15-33,2019-07-04-15-33,0
s.a19ca448-4280-45eb-bffd-7fce3cb4134a.txt,334666125,2,They might be saying that the group needs to be more generous with the needy.,3,3,2,2,6,5,2,1,6,5,2,2,cYN8upgf,2019-07-04-15-31,2019-07-04-15-32,1
s.bec90184-f513-4ae5-9740-3bca98010b3f.txt,334666100,1,They are irritated and pointing something out that’s negative about this group. ,4,5,7,7,2,2,5,6,2,3,5,4,6XEZySz2,2019-07-04-15-31,2019-07-04-15-34,3
s.c7f2fffe-4989-405f-86d5-5dc6b6cb9b80.txt,334666150,3,SHOWING THE HAND,5,5,7,7,3,7,6,4,6,6,6,5,JzS9tDKz,2019-07-04-14-55,2019-07-04-14-56,1
s.e54e2cd2-874d-4362-bc7b-6419eaa5fc0e.txt,334666350,2,"","","","","","","","","","","","","","",2019-07-04-15-33,"",""
s.e9f960a3-9723-4009-9f41-5d65f501492e.txt,334666350,3,"","","","","","","","","","","","","","",2019-07-04-15-27,"",""
s.da2f26b7-3801-49e2-849f-07cc017a1a79.txt,334666150,3,"","","","","","","","","","","","","","",2019-07-04-14-50,"",""
s.6b7872fc-74f7-4178-9fb8-641d699b5ec0.txt,334666395,1,"","","","","","","","","","","","","","",2019-07-04-15-39,"",""
s.17c0be81-4272-4227-bd33-d9123a49ebdd.txt,334666369,2,They are saying it's a big and positive group.,7,7,1,1,6,6,3,4,7,6,6,6,r2NFbZZO,2019-07-04-15-23,2019-07-04-15-24,1
s.6dd08852-0a23-4f92-b10a-e413a2fdcc84.txt,334666395,2,"Now, within this group, members are divided into two main subgroups.",5,5,5,5,4,4,3,5,4,3,4,4,XDGeEWMw,2019-07-04-15-42,2019-07-04-15-45,3
s.802850df-1b79-4499-959b-27d2c6b4e71d.txt,334666125,3,PLEASE SAVE THE WATER,"","","","","","","","","","","","","",2019-07-04-14-43,"",""
s.4322da47-ae15-47d4-bc01-647a393c3d66.txt,334666100,1,It seems like they are exasperated with the group. Not 100% sure though,5,5,6,6,4,3,2,5,3,3,3,3,UWATaZ2e,2019-07-04-15-27,2019-07-04-15-29,2
s.a06ff87e-25f2-4940-8b99-e57156a23dae.txt,334666350,1,I want to thank you all for being here today,6,6,1,1,5,4,3,6,5,5,5,6,j5McPZsX,2019-07-04-15-25,2019-07-04-15-27,2
s.cd639862-9524-4ae7-89c6-b3063a0f4ec2.txt,334666150,2,I think she is asking someone for a snack and put her hands out to receive the snack,4,2,3,3,5,3,5,4,2,4,3,1,bKePNfae,2019-07-04-15-37,2019-07-04-15-38,1
s.a6b86a8e-18db-4420-b44d-0a97a7c9d93b.txt,334666100,1,i think he is saying if they need help just come to him and ask,4,7,7,7,6,4,7,1,7,4,4,7,7puNy9ez,2019-07-04-15-24,2019-07-04-15-29,5
s.3005dd4f-87d0-4f60-86f2-7ee028ece8ce.txt,334666350,2,It looks like they are explaning something funny about someone else,6,4,2,2,6,4,3,5,6,5,5,6,MwzvKUUD,2019-07-04-15-27,2019-07-04-15-29,2
s.e816d91f-d415-4844-8eb7-c6ed3bdd7b08.txt,334666350,3,They are loud and or annoying. While making hand motions to demonstrate,6,5,4,3,5,4,5,5,5,5,6,6,9U8xqPbO,2019-07-04-15-33,2019-07-04-15-36,3
s.1badd9be-92ef-43ee-a601-746ef3e381d8.txt,334666369,2,She seems to be welcoming the group and introducing herself. ,6,6,1,1,7,5,4,4,7,7,7,6,3QH9pTf9,2019-07-04-15-31,2019-07-04-15-33,2
s.519af1e3-1309-46ab-92e1-25a068c27fe1.txt,334666395,2,The group must spread out to do the task.,7,7,3,4,7,1,2,4,1,4,6,1,KpVtHrMp,2019-07-04-15-35,2019-07-04-15-37,2
s.cd2e44da-d884-4dc5-8b86-dd58f2379893.txt,334666350,3,i think she is saying this is a big world,4,4,1,1,6,4,1,4,6,4,6,6,Q98F9ZH2,2019-07-04-15-26,2019-07-04-15-29,3
s.30b504ff-6cbd-494e-9f82-0071d44b91ff.txt,334666350,3,I think they are saying something negative and belittling. They are making fun of the group.,5,5,4,2,4,3,5,4,4,4,3,4,Xd4wRDBX,2019-07-04-15-25,2019-07-04-15-27,2
s.b9f30c7b-acea-4f89-bbfe-9b3c8524c75b.txt,334666369,2,nothing to write,4,4,2,3,5,4,4,7,4,2,4,5,VEfsD3U7,2019-07-04-15-32,2019-07-04-15-33,1
s.b49b2de8-fd75-4fcc-bd7d-b2f9c34af55d.txt,334666350,2,She is describing how the group is not cohesive and can't get along or agree on anything no matter how hard they try.,6,6,6,7,4,3,2,2,1,3,2,2,xcphVCVW,2019-07-04-15-25,2019-07-04-15-26,1
s.cd12e2f7-dd12-4a3b-ada9-8e3c3ce0d70b.txt,334666150,3,"United, together, I think they are saying we are one group and we are here.",4,4,1,7,5,2,1,2,7,1,1,1,Okr3gvjV,2019-07-04-15-37,2019-07-04-15-39,2
s.d7feabec-c34c-4656-98c0-9b983490abcc.txt,334666100,3,I think they are saying something about giving something to the people based on the arm movement.,4,4,2,2,5,5,5,4,5,5,5,5,cekpE3TX,2019-07-04-14-44,2019-07-04-14-45,1
s.6e638b73-00e7-4ca4-9a15-2adffa2e4f13.txt,334666395,3,"","","","","","","","","","","","","","",2019-07-04-15-25,"",""
s.556cacf0-9596-4be1-b975-53f8a2360939.txt,334666125,3,They hope that the group can come together and work closely together. ,6,5,4,5,4,4,3,4,7,7,3,3,Y6OSPuwM,2019-07-04-14-48,2019-07-04-14-50,2
s.04233883-ba8e-44f9-9a26-7778d354a263.txt,334666100,3,They are pleading the group to give something back to the speaker ,4,4,5,5,4,4,4,5,3,4,4,4,vG4aeH2F,2019-07-04-15-26,2019-07-04-15-28,2
s.d221eaba-dae3-471d-bcce-a035a9aa036a.txt,334666150,1,To share this with you.,6,6,2,2,6,6,2,2,6,6,5,6,gPSmaQFO,2019-07-04-15-36,2019-07-04-15-37,1
s.535e1ac6-89f5-4248-ac10-aaad4e06220b.txt,334666350,2,"She is describing something that the group does often or regularly. I think she's saying ""every time"".",4,4,2,3,5,4,5,2,5,7,6,6,uR8PPaUZ,2019-07-04-15-26,2019-07-04-15-28,2
s.ba0dd4e4-62c9-4854-ab54-174733038a95.txt,334666100,1,They're open.,6,5,7,5,4,4,1,5,2,6,5,2,DMJS2VUX,2019-07-04-15-32,2019-07-04-15-33,1
s.52620fdb-8ad1-4e27-98a7-f4090ca27ea6.txt,334666100,2,I need to give or provide something to you,4,4,2,1,5,5,4,4,6,4,5,4,9w9wXCCB,2019-07-04-15-24,2019-07-04-15-26,2
s.08584d20-134d-4317-946c-3e8f88ec676d.txt,334666395,3,the women asked to finished or equal to the content,4,6,7,4,5,5,6,3,7,3,5,6,bEze8WuD,2019-07-04-15-36,2019-07-04-15-38,2
s.0c6be549-f4a5-47ce-9413-590eac650dab.txt,334666350,3,The speaker seems to be praising the group of people.,6,6,3,2,4,5,4,3,6,5,6,4,4knvaBUX,2019-07-04-15-27,2019-07-04-15-30,3
s.29c85d5a-d342-4790-9d92-8c6d6a14be27.txt,334666350,3,"","","","","","","","","","","","","","",2019-07-04-15-44,"",""
s.db21b6a0-e37c-422c-8b82-e00eebe05f35.txt,334666125,3,I think the speaker is talking about the group coming together as a unit.,6,6,2,2,6,6,3,4,7,7,6,6,ss9bCJcf,2019-07-04-15-35,2019-07-04-15-38,3
s.24d71fa4-7eb8-4d5d-a0bc-3769cb188d98.txt,334666350,1,This is a great group of people! ,7,4,1,1,7,7,1,1,7,7,7,1,s4fgXUUt,2019-07-04-14-48,2019-07-04-14-50,2
s.7449810d-1a76-4836-b0e7-cc65f81171e6.txt,334666125,2,"","","","","","","","","","","","","","",2019-07-04-15-26,"",""
s.d3fd384a-53cc-44be-8396-80ec6a1fdce0.txt,334666369,2,i did not have any sound.,5,6,6,5,5,5,5,6,4,5,6,6,3DyxupqX,2019-07-04-15-24,2019-07-04-15-27,3
s.b009ae1c-b543-4434-b974-7941ab95a848.txt,334666150,1,making good communication and thinking,3,3,4,4,3,6,4,5,3,5,4,4,zVLpVetm,2019-07-04-14-51,2019-07-04-14-52,1
s.b51ff23a-6bdd-499f-af6a-e0e67d229377.txt,334666395,3,"","","","","","","","","","","","","","",2019-07-04-15-40,"",""
s.898b8e73-77d4-4e1c-a212-34ecbb5e1f78.txt,334666100,3,"opennes, greatness, together, appreciative, outgoing, great, loved. enjoying laughing",4,2,5,5,4,3,3,3,4,3,5,4,3KkNQxpn,2019-07-04-14-48,2019-07-04-14-51,3
s.91a2ff36-549b-4b7c-825e-f7224113b56f.txt,334666369,3,Good,4,5,4,4,4,4,5,4,4,4,4,4,XxsUr6Lx,2019-07-04-15-24,2019-07-04-15-24,0
s.d50a85a4-37df-408d-9fe5-fc80b0e00ba6.txt,334666369,1,They are saying it's a large group.,7,7,2,2,5,6,3,3,5,6,5,6,h6WpQcyr,2019-07-04-15-33,2019-07-04-15-34,1
s.bcb70a04-4032-43f3-85a6-f483a7793aa7.txt,334666350,1,"","","","","","","","","","","","","","",2019-07-04-15-28,"",""
s.7b04e2b8-bf4e-4df5-92b0-948581164469.txt,334666150,1,The group seems to be calm. It llooks like he was trying to express some kind of artistic idea,5,4,2,2,6,5,2,2,6,5,5,5,gCp6F7LD,2019-07-04-15-25,2019-07-04-15-29,4
s.afbd899e-4891-4efa-be21-2b4fbdcafecd.txt,334666150,1,I think they are signing for the deaf community and teaching people how to do so,7,5,4,4,5,3,4,4,5,4,4,4,rQfx4vFG,2019-07-04-15-29,2019-07-04-15-30,1
s.69a4e918-014b-45f9-a51f-22466754e2f7.txt,334666395,1,"I think they are explaining and discussing the arrangement of products on a display table, perhaps. Clearly, the discussion seems to be about many items.",6,6,1,1,2,1,4,6,7,7,6,6,bXQmBnh7,2019-07-04-15-27,2019-07-04-15-29,2
s.66e57322-2f8a-4796-9720-270f7dea0613.txt,334666350,3,Book store,4,7,4,5,5,7,5,1,6,7,6,7,UQZgap4X,2019-07-04-15-24,2019-07-04-15-26,2
s.46818eab-ce4d-4925-8354-336129c9ac7c.txt,334666395,2,SAME ,5,6,5,4,4,6,4,6,4,5,5,5,b7vGq3wZ,2019-07-04-14-55,2019-07-04-14-56,1
s.a091cb32-76cb-46e5-9bb8-8f983607e5db.txt,334666395,2,They are probally saying to chill out or to lay low.,"","","","","","","","","","","","","",2019-07-04-15-43,"",""
s.39646e9d-4b7b-4ece-bb32-fccc929f990e.txt,334666150,2,"","","","","","","","","","","","","","",2019-07-04-15-27,"",""
s.3ac36ef4-5cbd-4674-a17c-eb8d7f91dc92.txt,334666100,2,Give me your hands to test!!,"","","","","","","","","","","","","",2019-07-04-14-51,"",""
s.11f213f1-a348-4906-8503-99145f90fa52.txt,334666125,2,Video has no sound either here or at vimeo,4,4,2,4,5,4,4,3,4,4,4,4,2Uuntp6T,2019-07-04-14-43,2019-07-04-14-45,2
s.35dc4436-6f04-42b0-861f-dfe84c49a2aa.txt,334666125,2,They come together and help one another ,3,3,1,1,2,6,4,1,6,7,6,7,2vh7OUST,2019-07-04-15-24,2019-07-04-15-26,2
s.fdf0d18f-313b-4436-91fe-46d5a69b4c89.txt,334666395,3,that all,4,4,4,4,4,4,4,4,5,4,4,3,6HYK2k8C,2019-07-04-15-25,2019-07-04-15-27,2
s.accdb615-e4d3-4e5a-b4cc-616df176674c.txt,334666395,1,Do not do this action,2,2,2,3,4,4,5,2,5,3,3,5,DSEqAmwE,2019-07-04-15-41,2019-07-04-15-43,2
s.b5f164e2-74e7-4ffa-9f58-0aea330211d0.txt,334666395,3,the speaker is gesturing that the work group needs to calm down and deal with the problem.,7,7,7,6,5,3,5,7,7,7,3,4,6PCNmck6,2019-07-04-15-24,2019-07-04-15-25,1
s.dd88c01b-fc81-4fe2-93e5-ffeba9b8a2a1.txt,334666100,1,They are saying that the group can do it. They can accomplish the task at hand.,7,6,1,1,4,6,4,3,7,7,4,4,DrwsUKde,2019-07-04-15-25,2019-07-04-15-28,3
s.34e01bb0-306a-4f50-9669-49adcdb7874f.txt,334666150,2,that they should be willing to be charitable and give to others,4,4,2,2,6,6,3,2,7,7,5,5,OThpv889,2019-07-04-15-35,2019-07-04-15-36,1
s.f1bf2866-cedc-43e4-87c8-d4cc910b7b37.txt,334666395,1,"","","","","","","","","","","","","","",2019-07-04-14-49,"",""
s.2dbd80d3-c4f2-401f-9b18-8b4297ec5e90.txt,334666369,1,"","","","","","","","","","","","","","",2019-07-04-15-25,"",""
s.1abdd836-4e92-456a-8070-6c83e945279c.txt,334666125,1,resembles that make together each one and be unite,7,6,7,6,7,6,7,6,7,7,7,7,LfkAjKNK,2019-07-04-14-55,2019-07-04-14-56,1
s.962a6c2c-7e82-4460-a3ed-6373a5c7c087.txt,334666395,2,may b its breakup,4,5,5,4,3,6,4,5,5,5,5,4,8tqAjeMV,2019-07-04-14-44,2019-07-04-14-46,2
s.926c5e67-15ad-419f-8099-82b0089b6374.txt,334666350,3,talking about how actions affect everyone not just the intended person,3,5,5,2,4,4,4,4,5,4,2,2,NxBeQ2XH,2019-07-04-15-36,2019-07-04-15-37,1
s.ac53f4a9-a19f-48f8-9ce1-694bdb206a7c.txt,334666100,2,"The group is far away or their ideologies are more ""out there"".",4,4,5,5,2,3,5,6,5,6,6,6,g67HNvpK,2019-07-04-15-38,2019-07-04-15-41,3
s.2f704640-3166-4f3c-9a06-28e248cd48ad.txt,334666125,2,"","","","","","","","","","","","","","",2019-07-04-14-43,"",""
s.3bd45fa2-5131-479e-94b2-97d2eacf954f.txt,334666150,3,here is my favorite object will you take it from me please?,5,4,2,2,5,3,4,4,6,2,6,6,HeG3NYD9,2019-07-04-15-27,2019-07-04-15-29,2
s.6cba8fac-3c67-4b60-9354-ed5f9adc927a.txt,334666395,3,The discussion in the group has ended for the day.,"","","","","","","","","","","","","",2019-07-04-15-40,"",""
s.21056370-6a7b-4ec2-a1ea-0d338598406f.txt,334666350,2,"The speaker is talking about the group's overarching mission, or about them being under the same umbrella.",4,4,1,3,2,2,4,2,7,7,4,4,W9qDCmHK,2019-07-04-15-32,2019-07-04-15-35,3
s.cd5ea906-0a20-48bd-911b-ccbc2c4c334a.txt,334666395,1,They are even,5,5,5,4,4,4,4,5,3,4,4,4,98866rF3,2019-07-04-15-24,2019-07-04-15-25,1
s.2a87e9b4-aa82-46db-ac87-b14dccee6320.txt,334666100,2,I’m giving you something to help assist you and benefit you do you want if,4,4,5,4,3,5,4,2,4,2,3,5,LtBqNTUx,2019-07-04-15-27,2019-07-04-15-28,1
s.dd7ad75a-7774-4a48-8936-e59632523970.txt,334666369,1,"I think the speaker is saying ""that's not all""",5,6,3,2,5,6,3,5,6,5,6,2,nwFBwM9X,2019-07-04-15-25,2019-07-04-15-28,3
s.3908ef11-b52a-4bd0-b751-4279034ccf18.txt,334666100,3,"","","","","","","","","","","","","","",2019-07-04-14-51,"",""
s.e415773a-d847-407e-a3f2-0e1e46465b8c.txt,334666125,1,"","","","","","","","","","","","","","",2019-07-04-15-25,"",""
